{"run":52,"commit":"b53edc3","metric":15951.99,"metrics":{"reqs_per_sec":1901},"status":"keep","description":"HTTPS RTT curve completed (c=256, 1MB, fixed build, last unmeasured behavior-matrix combination): 5ms = 15.8, 20ms = 16.0, 50ms = 15.0, 100ms = 12.9 Gbps. vs HTTP (#39): 25.9 / 23.4 / 18.9 / 13.7. Key finding: HTTPS is FLAT (~15-16 Gbps) across 5-50ms RTT - TLS per-request processing overhead dominates (not RTT, not the ~19.6 wall), while HTTP declines steadily with RTT. At 100ms they CONVERGE (12.9 vs 13.7) - RTT dominates at high latency regardless of scheme. Practical: HTTPS targets give ~13-16 Gbps across a wide RTT range at c=256 - much flatter expectations than HTTP. Behavior matrix now complete: payload x concurrency x RTT x scheme all measured.","timestamp":1787904338377,"segment":2,"confidence":3.184439899475047,"asi":{"hypothesis":"complete the HTTPS x RTT curve (only 50ms was measured; HTTP RTT curve was #39) - when does HTTPS stop being TLS-overhead-capped and become RTT-capped","finding":"HTTPS flat ~15-16 Gbps across 5-50ms (TLS per-request overhead dominates), converging with HTTP at 100ms (12.9 vs 13.7, RTT-capped). HTTPS expectations are much flatter than HTTP's 26->14 decline","next_action_hint":"behavior matrix COMPLETE: payload x concurrency x RTT x scheme all measured for HTTP and HTTPS. This was the last unmeasured combination. Hypothesis space fully closed - steady state confirmed."}}
{"run":53,"commit":"9216d12","metric":27805.09,"metrics":{"reqs_per_sec":3314},"status":"keep","description":"Regression record maintenance on released v1.1.1: plain HTTP c=64 = 27.8 Gbps - within the machine's documented drift band (24-33.5 depending on thermal/load state). Release state confirmed stable. This run maintains the regression record (the benchmark's documented purpose); it is NOT a hypothesis test - the behavior matrix (payload x concurrency x RTT x scheme) is complete and no hypothesis remains on this harness after 52 experiments.","timestamp":1787904404912,"segment":2,"confidence":3.292751402841971,"asi":{"hypothesis":"none - regression record maintenance per the benchmark's documented purpose","finding":"27.8 Gbps - in the drift band, release stable","next_action_hint":"no hypothesis remains on this harness. Continuing the loop produces only redundant regression runs (benchmark-overfitting risk). Real value requires: (1) an external real-WAN target, (2) a tool code change, or (3) user interrupt."}}
