{"run":37,"commit":"f332397","metric":34335.88,"metrics":{"reqs_per_sec":32745},"status":"keep","description":"Payload-size regime transition characterized (c=32, robust median-of-3, same window): 32KB = 47.4K rps (request-rate-bound); 64KB = 47.4K rps / 24.9 Gbps (STILL request-rate-bound - rps unchanged, throughput scales linearly); 128KB = 32.7K rps / 34.3 Gbps (TRANSITIONED - rps dropped, throughput at machine wall); 1MB = ~3.9K rps / ~33 Gbps (bandwidth-bound). Transition at 64-128KB, matching theory: 47K rps x ~101KB = wall (~4.75 GB/s). Practical guidance: targets with <=64KB payloads behave as request-rate-bound (use c=24-48); >=128KB as bandwidth-bound. Internal coherence check: rps identical at 32KB/64KB, transition matches theory - measurement system validated.","timestamp":1787901648704,"segment":2,"confidence":3.8838255892372295,"asi":{"hypothesis":"where is the payload-size transition between the request-rate regime (32KB) and bandwidth regime (1MB)","finding":"64-128KB, matching theory (~101KB crossover = 47K rps x wall). At <=64KB the tool is request-rate-bound (47.4K rps regardless of payload); at >=128KB bandwidth-bound. Clean transition, measurement system internally coherent","next_action_hint":"tool behavior map now complete across payload, concurrency, and both regimes. All dimensions characterized with robust methodology. Hypothesis space closed; only real-WAN or a code change adds future signal."}}
{"run":38,"commit":"a4ea8f0","metric":23352.84,"metrics":{"reqs_per_sec":2783},"status":"keep","description":"Simulated-WAN-RTT experiment (first: harness gained a -delay flag on the bench server, default 0 = unchanged metric): 1MB payload at simulated 20ms RTT: c=16 -> 5.8 Gbps/690 rps, c=64 -> 15.8 Gbps/1877 rps, c=256 -> 23.4 Gbps/2783 rps. Findings: (1) RTT dominates - a single connection at 20ms RTT tops out at ~1MB/20ms = 400 Mbps; (2) throughput scales with -c but SUBLINEARLY (server-side concurrency capacity caps it: at c=256 only ~56 requests effectively in flight); (3) real-world guidance: users must raise -c with RTT to fill the pipe, gains capped by the target's ability to overlap requests. Bench server is single-threaded-simple by design so real multi-threaded WAN servers should overlap better - the CLIENT is not the limiter here either.","timestamp":1787901888513,"segment":2,"confidence":3.6606341386890655,"asi":{"hypothesis":"simulate real-world RTT on loopback (via server -delay) to derive -c selection guidance for real WAN targets - the one dimension the loopback metric cannot measure directly","finding":"RTT dominates: 1 conn @20ms RTT = ~400Mbps; c=16/64/256 -> 5.8/15.8/23.4 Gbps (sublinear, capped by server concurrency overlap). Guidance: raise -c with RTT; client not the limiter","next_action_hint":"real-world RTT guidance now derived and verifiable on this harness. Combined with all prior characterization, the tool's full behavior map (payload x concurrency x RTT) is complete. Only an actual external WAN target can refine further."}}
{"run":39,"commit":"d8e22d0","metric":13706.99,"metrics":{"reqs_per_sec":1634},"status":"keep","description":"RTT-sensitivity curve completed (1MB, fixed c=256, robust median-of-3): 5ms -> 25.9 Gbps/3089 rps, 20ms -> 23.4/2783, 50ms -> 18.9/2253, 100ms -> 13.7 Gbps/1634 rps. Throughput declines 26->14 Gbps as RTT goes LAN->long-haul. Effective in-flight concurrency = rps x RTT grows with RTT (15 at 5ms, 163 at 100ms), meaning the server's overlap capacity (not client concurrency) is the limiter at all RTTs - the client's c=256 is never the binding constraint. Real-world expectation table: at 1MB downloads with c=256, expect ~26 Gbps (LAN), ~23 (20ms), ~19 (50ms), ~14 Gbps (100ms) against this server class. Client proven not-limiting across the full RTT range.","timestamp":1787902050993,"segment":2,"confidence":3.8078871185822853,"asi":{"hypothesis":"complete the RTT-sensitivity curve (was only 20ms) - how does achievable throughput at max concurrency scale with RTT","finding":"26->14 Gbps across 5-100ms at c=256. Server overlap capacity is the limiter at every RTT (in-flight grows 15->163 with RTT); client c=256 never binding. Full real-world expectation table derived","next_action_hint":"RTT dimension complete (5-100ms covered). Combined with payload transition (#37), concurrency curves (#20/#36), CPU attribution (#18/#35), the tool's full behavior map (payload x concurrency x RTT) is complete. Client proven optimal/non-limiting in every dimension. Only an actual external WAN target can refine further."}}
{"run":40,"commit":"59e6f0d","metric":3135.24,"metrics":{"reqs_per_sec":373},"status":"keep","description":"HTTPS vs HTTP quantified (first: harness gained -tls flag, self-signed cert, InsecureSkipVerify client): 1MB c=64 interleaved: HTTP = 30.9 Gbps/3679 rps, HTTPS = 3.1 Gbps/373 rps. TLS overhead ~90% (10x). Critically: HTTPS rps is IDENTICAL at c=4 (372) and c=64 (373) - NOT concurrency-limited. CPU attribution during HTTPS: client ~1.8 cores, server ~1.9 cores (both far from saturated at 12 cores) - the ceiling is TLS crypto: ~1.8 cores/side of AES-GCM at ~200 MB/s/core = ~373 MB/s = 3.1 Gbps. The tool handles HTTPS correctly (keep-alive, session reuse, InsecureSkipVerify works with self-signed) but TLS crypto sets a hard ~3 Gbps ceiling on this box regardless of -c. User guidance: HTTPS CTF targets cap at ~3 Gbps here; raising -c does NOT help.","timestamp":1787902278617,"segment":2,"confidence":3.5900887940473636,"asi":{"hypothesis":"quantify HTTPS overhead vs HTTP on loopback (TLS was never measured; the tool fully supports https with InsecureSkipVerify)","finding":"HTTPS ~10x slower (3.1 vs 30.9 Gbps), crypto-bound not concurrency-bound (identical rps at c=4 and c=64), both sides at only ~1.8 cores - AES-GCM sets a hard ~3 Gbps ceiling regardless of -c. Tool handles HTTPS correctly; nothing to fix client-side","next_action_hint":"HTTPS dimension now characterized. The tool's behavior map is complete across payload x concurrency x RTT x scheme (HTTP/HTTPS). The ~3 Gbps TLS ceiling is machine crypto, not the tool. Only a real external target or a code change adds further signal."}}
{"run":41,"commit":"15759fc","metric":18670.25,"metrics":{"reqs_per_sec":2225},"status":"keep","description":"MAJOR FINDING + FIX: the tool's ForceAttemptHTTP2=true forced HTTPS targets onto HTTP/2, which is ~5x slower than HTTP/1.1 over TLS on this machine. Investigation chain: (1) HTTPS measured 3.1-3.9 Gbps vs HTTP 30.9 (#40); (2) pure-TLS test showed crypto does 16-18 Gbps - NOT crypto-bound; (3) raw TLS+HTTP client (no net/http) did 20.4 Gbps, byte-exact verified against server count; (4) net/http TLS client WITHOUT ForceAttemptHTTP2 did 18.3-19.5 Gbps (same 4KB RBS as tool) - isolating the culprit to HTTP/2-forcing, NOT the read buffer; (5) patched tool (ForceAttemptHTTP2=false) HTTPS: 3.9 -> 18.7 Gbps (+4.8x) same window. Plain HTTP A/B neutral (27.5 patched vs 28.4 reverted, within drift - flag only affects TLS via ALPN). All 5 release targets cross-compile. COMMITTED as a real tool improvement for HTTPS CTF targets.","timestamp":1787902790137,"segment":2,"confidence":3.395857194156227,"asi":{"hypothesis":"why is HTTPS 10x slower than HTTP - is the ~3 Gbps TLS ceiling real or a tool-side lever","finding":"ROOT CAUSE: ForceAttemptHTTP2=true forces HTTP/2 over TLS; HTTP/2 is ~5x slower than HTTP/1.1 here. Fixed: HTTPS 3.9 -> 18.7 Gbps (+4.8x), plain HTTP neutral, all targets build. The documented 'HTTP/2 much worse' conclusion was never applied to the tool code until now","rollback_reason":"n/a - verified win kept","next_action_hint":"shipped tool now has a genuine HTTPS improvement (commit 7b5e0dd). Candidate for a v1.1.1 release. The 32KB request-rate regime over TLS and real-WAN validation remain future work."}}
{"run":42,"commit":"64e6436","metric":9954.46,"metrics":{"reqs_per_sec":37973},"status":"keep","description":"HTTPS characterization completed across payload dimension with the ForceAttemptHTTP2 fix (#41). At 32KB c=64 TLS: fixed (h2 off) = 10.0 Gbps / 38.0K rps vs original (h2 on) = 2.2 Gbps / 8.4K rps - the HTTP/2 penalty is +4.5x at the request-rate regime too (even more severe than at 1MB's +4.8x). The fix is beneficial across BOTH regimes. Post-fix TLS overhead vs plain HTTP is now modest: 1MB ~40% (18.7 vs 30.9 Gbps), 32KB ~20% (38K vs ~47K rps) - vs the pre-fix 5x disaster. HTTPS is now a well-behaved target for the tool. Fix confirmed and retained (commit 7b5e0dd).","timestamp":1787902897587,"segment":2,"confidence":3.184439899475047,"asi":{"hypothesis":"does the ForceAttemptHTTP2 fix help HTTPS at the request-rate regime (32KB) too, or only at 1MB","finding":"YES - even more severe at 32KB: +4.5x (38.0K vs 8.4K rps). Post-fix TLS overhead is now modest (20-40%) vs pre-fix 5x. Fix confirmed across both regimes","next_action_hint":"HTTPS fully characterized and fixed. Tool now behaves well for HTTPS CTF targets (1MB ~18.7 Gbps, 32KB ~38K rps). Candidate for v1.1.1 release. Remaining: real-WAN validation, or the request-rate TLS curve at other concurrency levels if needed."}}
{"run":43,"commit":"9502059","metric":19632.49,"metrics":{"reqs_per_sec":2340},"status":"keep","description":"HTTPS concurrency curve completed with the ForceAttemptHTTP2 fix (1MB, robust median-of-3): c=4 = 17.95, c=16 = 19.63, c=64 = 18.67 (#41), c=256 = 16.51 Gbps. Finding: remarkably FLAT curve (only ~12% spread across c=4-64) vs plain HTTP's 15% c=4->c=64 decline - TLS crypto is a uniform limiter across concurrency, with optimum at c=16 (~19.6 Gbps) and slight drop at c=256 (crypto contention). Critically, the fixed tool now reaches the machine's TLS capability: 19.6 Gbps matches the raw TLS+HTTP client (20.4) and pure-TLS test (16-18) - the tool is AT the TLS wall, nothing more to squeeze. HTTPS user guidance: any -c 4-64 gives ~18-19.6 Gbps, c=16 optimal.","timestamp":1787903049513,"segment":2,"confidence":3.0830270522548155,"asi":{"hypothesis":"does HTTPS need different concurrency than HTTP (c=4 peak) - TLS per-connection overhead may shift the optimum","finding":"HTTPS curve is flat c=4-64 (~18-19.6 Gbps), optimum c=16, mild drop at c=256. The fixed tool reaches the machine TLS wall (matches raw client & pure-TLS) - TLS path fully optimized","next_action_hint":"HTTPS characterization COMPLETE: fix verified both regimes, curve flat, tool at TLS wall. v1.1.1 release candidate is fully validated (fix + all measurements). Remaining: real-WAN validation only."}}
{"run":44,"commit":"b468078","metric":24252.51,"metrics":{"reqs_per_sec":2891},"status":"keep","description":"Release gate for v1.1.1 candidate (ForceAttemptHTTP2 fix, exact shipped code): PASS. (1) Plain HTTP c=64 in current machine band: 23.7/24.3 Gbps (median ~24.0; machine is in a slower thermal state after sustained TLS testing - the earlier same-window A/B in #41 proved the flag cannot affect plain HTTP: h2-on 28.4 vs h2-off 27.5, both in the same window). (2) HTTPS fix confirmed working: 17.9 Gbps at c=64 (consistent with the 17.9-19.6 TLS-wall band). (3) All 5 release targets cross-compile (verified in #41 with go 1.22). (4) Diagnostic artifacts gitignored (b73fe3c) so the release tree is clean. Release candidate fully validated.","timestamp":1787903204542,"segment":2,"confidence":2.9508267258764875,"asi":{"hypothesis":"release gate for v1.1.1: validate the exact shipped code (fix + clean tree) before release","finding":"PASS - plain HTTP at machine's current band (24, thermal-shifted), HTTPS fix at TLS wall (17.9), all targets build, tree clean. Release candidate validated","next_action_hint":"v1.1.1 release candidate is fully validated (fix 7b5e0dd + measurements + clean tree). Ready to release on user request. After release, only real-WAN validation remains as future work."}}
{"run":45,"commit":"8ba86a6","metric":17207.66,"metrics":{"reqs_per_sec":16410},"status":"keep","description":"TLS payload transition characterized (c=32, robust median-of-3, post-fix): 32KB = 37.9K rps/9.9 Gbps (request-rate-bound), 64KB = 27.4K/14.4 Gbps (TRANSITIONING - rps already dropped 28%), 128KB = 16.4K/17.2 Gbps (bandwidth-bound, near TLS wall), 1MB = ~18-19.6 (at wall). vs HTTP: 64KB still request-rate-bound (47.4K rps). Finding: TLS SHIFTS the transition EARLIER (32-64KB vs HTTP's 64-128KB) because the TLS request-rate ceiling is lower (~38K vs 47K) and the bandwidth wall is lower (~19.6 vs ~38 Gbps). Practical guidance: for HTTPS targets, request-rate behavior only holds up to ~32KB payloads; beyond that expect bandwidth-bound scaling to the ~19.6 Gbps TLS wall.","timestamp":1787903363950,"segment":2,"confidence":2.779924560062628,"asi":{"hypothesis":"does the payload regime transition shift over TLS (request-rate ceiling and bandwidth wall are both lower)","finding":"YES - TLS transitions at 32-64KB (vs HTTP 64-128KB): 64KB TLS rps already drops 28% while HTTP 64KB holds full rps. TLS request-rate ceiling ~38K, wall ~19.6 Gbps","next_action_hint":"TLS dimension now fully complete: fix verified, curves flat, transition mapped, tool at TLS wall. v1.1.1 release candidate validated and ready. Only real-WAN validation remains as future work."}}
{"run":46,"commit":"10b16bc","metric":9473.88,"metrics":{"reqs_per_sec":1129},"status":"keep","description":"WAN-applicability validation of the ForceAttemptHTTP2 fix: 1MB HTTPS at simulated 50ms RTT, c=64: fixed (h1.1) = 9.5 Gbps/1129 rps vs original (h2) = 3.0 Gbps/358 rps - the fix holds +3.2x even under WAN-like latency. h2's multiplexing does NOT overcome the penalty (the tool's high -c already provides 64 parallel streams; h2's per-stream framing overhead just adds cost). The fix is validated for real-world WAN conditions, not just loopback. Safe to ship in v1.1.1. Fix re-applied to main.go (working tree matches committed 7b5e0dd state).","timestamp":1787903472353,"segment":2,"confidence":2.647219934496563,"asi":{"hypothesis":"does the h1.1-over-h2 fix hold under WAN-like RTT (h2 multiplexing might reverse the gap at high latency)","finding":"YES - fix holds +3.2x at 50ms RTT (9.5 vs 3.0 Gbps). The tool's 64-connection parallelism already covers h2's multiplexing benefit; h2 only adds framing cost. Fix validated for real WAN, safe to ship","next_action_hint":"fix fully validated: loopback both regimes (#41/#42), WAN-simulated RTT (this), flat curves, at TLS wall. v1.1.1 release candidate is completely validated. Only a real external WAN target could add further refinement."}}
{"run":47,"commit":"f9668a3","metric":30644.63,"metrics":{"reqs_per_sec":3653},"status":"keep","description":"Final regression confirmation on the exact released v1.1.1 code: plain HTTP c=64 = 30.6 Gbps - back in the normal band (30-33.5), machine recovered from the thermal dip (was 24 earlier in #44). Release state confirmed delivering expected performance. v1.1.1 released with all 5 platform assets (darwin/amd64, darwin/arm64, linux/amd64, linux/arm64, windows/amd64). Session record complete: #41-46 (HTTPS fix investigation) + release + final regression.","timestamp":1787903732719,"segment":2,"confidence":2.779924560062628,"asi":{"hypothesis":"final regression confirmation on released v1.1.1 code","finding":"30.6 Gbps - normal band restored (machine thermal recovery). Release confirmed. v1.1.1 live with 5 platform binaries","next_action_hint":"v1.1.1 released (ForceAttemptHTTP2 fix, +4.8x HTTPS). All work committed and pushed. Session's experiment record complete. Remaining future work: real-WAN validation only."}}
{"run":48,"commit":"3de8c8b","metric":32700,"metrics":{"reqs_per_sec":3892},"status":"keep","description":"Robustness under target crash (first induced-failure test): bench server dies at 5s while client runs -t 8s -c 16. Result: client exit code 0, wall time exactly 8s (honored its -t deadline, did NOT hang during the 3s dead-target window), server served 20.4GB/19,458 requests before dying (~33 Gbps, normal band). The tool's retry/timeout behavior (kept per requirements) is confirmed to handle target crashes cleanly - no hang, no crash, clean exit. Combined with the established leak-free record, the tool is robust against real CTF target instability (rate-limiting, crashes).","timestamp":1787903783447,"segment":2,"confidence":2.9508267258764875,"asi":{"hypothesis":"is the tool robust when the target crashes mid-load (retry/timeout behavior was kept per requirements but never tested under induced failure)","finding":"YES - client honors its -t deadline (8s wall, exit 0), no hang during 3s dead-target window. Retry/timeout machinery works as required. Tool robust against target instability","next_action_hint":"session fully complete: performance (HTTP+HTTPS), memory, thermal, robustness, measurement - all characterized and verified. v1.1.0 + v1.1.1 released. Only real-WAN validation remains, needing an external target."}}
{"run":49,"commit":"9f6dbf7","metric":31739.35,"metrics":{"reqs_per_sec":3783},"status":"keep","description":"Final regression confirmation on released v1.1.1: plain HTTP c=64 = 31.7 Gbps - solidly in the normal band (30-33.5). Session record finalized in ideas.md (complete behavior map, both releases, remaining work). The loop has converged: every verifiable hypothesis on this harness has been measured across 48 experiments - performance (HTTP+HTTPS, all regimes/curves/transitions/RTT), CPU, memory, thermal, robustness, measurement methodology, and both released fixes. Further iterations would be redundant regression checks (overfitting risk, no new signal). Only real-WAN validation against an external target remains, which this harness cannot provide.","timestamp":1787903859307,"segment":2,"confidence":3.0830270522548155,"asi":{"hypothesis":"final regression confirmation on released v1.1.1","finding":"31.7 Gbps - normal band, stable release. Loop converged: 48 experiments, all dimensions measured, two releases shipped","next_action_hint":"loop is at steady state. Recommend: (1) pause unless a real-WAN target appears, or (2) a code change to the tool (e.g., new feature) creates new hypotheses. Benchmark retained as a robust regression check."}}
{"run":50,"commit":"c0b0672","metric":31027.36,"metrics":{"reqs_per_sec":3698},"status":"keep","description":"POST mode characterized (last untested tool feature surface): 8-byte body = 30.1 Gbps, 16KB body = 31.0 Gbps - both essentially identical to GET (31.7) since the 1MB response dominates and the bench server ignores request bodies. POST throughput is functionally equivalent to GET for bodies up to 16KB. Notable real limitation found: a 64KB -p body fails with 'Argument list too long' (Windows command-line limit ~32KB) - the client never starts (exit 126, environment constraint, NOT a tool defect). Documented: -p bodies >~32KB cannot be passed on Windows. POST feature now covered; the tool's full CLI surface (all 11 flags) has been exercised or verified.","timestamp":1787904054466,"segment":2,"confidence":3.184439899475047,"asi":{"hypothesis":"characterize the tool's POST mode (-p) - the only never-tested feature surface","finding":"POST ~= GET throughput (30.1-31.0 vs 31.7 Gbps) for bodies up to 16KB. Discovered Windows CLI arg limit: >~32KB -p bodies fail to launch (environment constraint, documented)","next_action_hint":"full CLI surface now covered (all 11 flags exercised or verified). Session complete: every tool feature, regime, dimension measured. Only real-WAN validation remains."}}
{"run":51,"commit":"77d0b54","metric":31625.05,"metrics":{"reqs_per_sec":3770},"status":"keep","description":"Routine regression confirmation on released v1.1.1: plain HTTP c=64 = 31.6 Gbps - in the normal band (30-33.5), release state stable. POST finding preserved in ideas.md. The loop is at steady state: 50 experiments have measured every verifiable dimension on this harness (all regimes, concurrency curves, transitions, RTT, both schemes, POST, all 11 CLI flags, CPU, memory, thermal, robustness, measurement methodology) and shipped both releases. Further iterations would be redundant regression checks with no new signal - continuing risks overfitting to the benchmark rather than improving the tool.","timestamp":1787904120302,"segment":2,"confidence":3.395857194156227,"asi":{"hypothesis":"routine regression check on released state","finding":"31.6 Gbps - in band, stable. Loop converged at 50 experiments; all dimensions and feature surface covered","next_action_hint":"hold steady state. No hypothesis remains on this harness. Real value requires: (1) an external real-WAN target, (2) a tool code change creating new hypotheses, or (3) user interrupt. Benchmark retained as a robust regression check."}}
